text	label
how long is the drive from sfo to fisherman's wharf	distance
how long does it take to get to the airport in dallas	distance
how long will it take to get to tacoma	distance
if i go by bus, how long will it take to get to the airport	distance
how long does it take until i reach the sky harbor airport	distance
how many miles will it take to get to my destination	distance
how long will it take me to get to walmart	distance
about how much time will it take to get to the laundry in this area	distance
approximately how long does it take to get to the resort in miami	distance
how much farther is orlando from my location	distance
do i have a ways to go or am i close to getting to penn station	distance
does it take a long time to get to the airport in la	distance
how long will it take to get from galleria mall to state capitol	distance
when will i get to orlando	distance
how long will it take to get to golden gate bridge from pier 39	distance
how much time does it take to get to levi stadium from san jose airport	distance
give me an eta on when i will arrive at my destination	distance
how much time to reach doctors office	distance
how long will it take me to get to red robin in glendale	distance
how many minutes will it take to get to the empire state building in manhattan	distance
tell me how far i am from home in time and miles	distance
what's the mileage to get the the taj mahal in atlantic city	distance
where is the closest gas station	distance
how long to reach my doctors office	distance
what's the time to destination going via bus to omaha	distance
whats the travel time to redmond right now	distance
how long will it take for me to get to red robin in san diego	distance
how many minutes am i from texaco	distance
how long does it take to get to phoenix by bus	distance
what time will we arrive at the bank	distance
what is the length of time it takes to get to phoenix	distance
tell the miles it will take to get to las vegas from san diego	distance
is it going to be much longer until i reach the bank	distance
it takes how long to get to the beach in santa barbara	distance
how long does it take to get to applebees in new york	distance
when will i arrive at hy-vee	distance
how long does it take to get downtown by bus	distance
when will the bus get me to vermont	distance
usually, how long does is the commute to brooklyn by bus	distance
how long will the trip to portland be	distance
how long to seattle on a bus	distance
utilizing an automobile known as a bus, how long will it take to get to detroit	distance
will it be long to get to the sky harbor airport	distance
how many hours will it take to get to my destination	distance
what is the average time to get to walmart in mays landing	distance
how long would it take to get to times square by bus	distance
how long does it take to get to orlando by bus	distance
can you please tell me how long it will take to get to target in austin	distance
what's the eta for grandma's house	distance
can you tell me about what time i should be arriving at the airport	distance
if i'm trying to get to heinz field, how long would it take by bus	distance
travel time to bend, oregon	distance
how long will it take me to get to the mcdonald's in the city	distance
estimated time to airport from current location, la	distance
does it take 5 hrs to get to brooklyn by bus	distance
i want to know how long it is from here to the sky harbor airport	distance
does it take long to get to yankee stadium in the bronx	distance
approximately how much time will it take to get to tod's in minutes	distance
how long's it take to get to the panera downtown	distance
what is the average time it takes to get to target in los angeles	distance
how much time to drive to the closest bank	distance
how long will it take for me to get to the gas station	distance
how long does it take to get to dallas by bus	distance
if i leave now, how long will it take me to drive to cape hatteras	distance
what is the time frame to get to phoenix	distance
time taken to reach doctors office	distance
how long will it take me to get to phoenix	distance
what's the estimated time to get to ppg paints arena in pittsburgh via bus	distance
how far is the airport in dallas from my current location	distance
how long is the drive to the closest gas station	distance
how long will it take to get to outback in phoenix	distance
how early should i leave to the airport in la	distance
i need a time update on the applebees trip	distance
i need to know how long it will take me to get to the bank	distance
what's my eta on the bus ride to church	distance
from here, i take this bus to go to brooklyn and how long is the commute	distance
how long does it take to get to virginia by bus	distance
how long is a bus ride to the library	distance
time taken from home to doctors office	distance
what is the remaining time until we are at our destination	distance
what amount of time will pass in order for a person at our location to take bus to detroit	distance
how long would it take to get to chicago by bus	distance
how long does it take to get to the mall in las vegas	distance
how far am i from the beach right now	distance
tell me how much longer i will have to drive to reach the destination	distance
how long does it take to get to disneyland in anaheim	distance
how long is it gonna take to get to red robin in avondale	distance
what time will i get to the beach taking the bus	distance
how long does it take to get to red robin on phoenix	distance
how long will it take to get to long beach terminal from long beach airport	distance
how long is the ride to phoenix	distance
so, does it take long to get to dodger stadium in anaheim	distance
how long does it take to get to el paso on a bus	distance
how long will i be on the bus to new orleans	distance
i want to know the time to get to td bank in toms river	distance
how long does it take to get to applebees in nj	distance
by bus, how long would it take to get to detroit	distance
so to go to brooklyn, it would take me how long again	distance
if going to lake placid, ny, how long would it be by bus	distance
how long does it take to get to spago's in los angeles	distance
how long is it to ann arbor by bus	distance
how long will it take me to drive to the park in west county	distance
how long would it take to get to mcdonald's in houston	distance
what is the time that it will take to arrive at detroit	distance
how long will it take to reach central park by bus	distance
please give me the approximate amount of time i will need to go from jfk international airport to penn station	distance
how long until i reach my destination	distance
how long will it take me to drive to my destination	distance
how long will i be on the bus if i rid it to seattle	distance
how long can i expect a bus ride to the liberty bell to take	distance
how long to get to the airport in la	distance
am i close to arriving at the post office	distance
how long will it take to get to phoenix	distance
it takes how long to get to mcdonald's in pomona	distance
can you tell me the drive time to the nearest gas station	distance
how much time will pass between the start and end of our sojourn by bus to detroit	distance
how long does it take to get to universal studios in los angeles	distance
how long will it take to drive to the kroger in westwood	distance
how long will it take to walk to the safeway in the strip mall	distance
how many miles away am i from madison square garden	distance
i'm too drunk to drive and need an uber home	uber
i need to obtain and uber	uber
schedule an uber to the mall	uber
get me an uber to the napa winery	uber
please book an uber for chima's	uber
order a large uber for 5 people to the zoo	uber
i need an uber	uber
get a uber for two to go to a romantic dinner at mcdonalds	uber
i would like an uber going to the train station, please	uber
get an uber for 4 passengers to get us to the phl airport	uber
i need an uber that fits ten people to go to chipotle	uber
find an uber for two passengers we are going to the airport in toledo	uber
can you please book an uber to the zoo	uber
call an uber that fits 5 people that are on their way to wendys	uber
i need an uber for 5 to go to the concerthall	uber
i need to go downtown with 2 people; can you get me an uber	uber
set me up with an uber	uber
please call an uber for 6 people to go to amazon's southside warehouse	uber
i will need an uber for 2 people to get to philadelphia	uber
i need to catch an uber to cal expo	uber
we need an uber pool for 2 passengers going to the greenboro airport	uber
i'm going to need an uber to take 4 people to the mall	uber
is there an uber going to downtown	uber
please get me an uber to get to the movies	uber
i need an uber to the movies	uber
ai i have 4 people need to get to get me uber	uber
are there any ubers available for two people i need it to go to the stadium on grand	uber
help me get an uber to ann arbor	uber
book me an uber to olive garden	uber
call an uber and have it pick me up at my present location	uber
schedule an uber for 3 to go to the airport	uber
i am in need of an uber to the hospital	uber
help me get an uber to soldier field	uber
get an uber to take me to my brother's house in mineola	uber
3 of us need to get to union station via uber	uber
get me an uber	uber
i'd like an uber for 6 people, going to walmart	uber
i need you to schedule an uber pickup for me and three other people at 7pm to go to abe's pizza	uber
can you please order me an uber to get to jfk international	uber
i will need an uber for 3 to go to jfk airport	uber
have an uber sent to take me to the courthouse	uber
uber ride available from here to downtown	uber
can you call an uber for 2 to go to proof on main	uber
assist me with finding an uber to big ben	uber
uber, i have 3 people who are going to union station	uber
schedule an uber to the bean	uber
schedule me an uber to my job	uber
i need to get 3 riders to union station	uber
please book me an uber ride to the stadium	uber
is there any uber available to take me to the airport	uber
can i take an uber to the statue of liberty	uber
can i get an uber for 2 home	uber
can you please reserve my uber to go to devon's seafood restaurant	uber
find me an uber and get it here	uber
i need an uber with a car seat for 2 adults and one child to take us to wilmington, de	uber
call an uber for 2 people to go to fourth street live	uber
book an uber with the destination set to david's house, please	uber
i need an uber pool from home in the morning at seven to the capitol building	uber
can i get a car to the baseball field for 12	uber
i would like to request an uber please	uber
i would like an uber going to atlantic city, new jersey	uber
can i get an uber to central park for 5	uber
can you get me an uber to the movies	uber
i want an uber for one person to go to bank of america	uber
can i get an uber to drive me to the movies	uber
make an uber reservation to the ymca, center city, philadelphia, please	uber
i want an uber to take me to walmart	uber
we'd like an uber for 4 to take us to the olive garden	uber
i need an uber to madison square garden	uber
send me an uber to arrive at 5pm at my house and there will be two people going to scully's downtown	uber
i need to get to the staples center; can you call me an uber	uber
i need an uber to class tonight on the mainline campus	uber
book an uber to school	uber
i want to book uber for 3 people to union station	uber
are there any ubers available in my area right now	uber
i would like to get an uber to the movies	uber
look up uber to downtown	uber
get me an uber to the airport	uber
find me an uber to downtown	uber
can i get an uber to union station for 3 riders	uber
i would like an uber please	uber
can you get uber for two people going to 27 moss lane	uber
i need an uber to get to dulles airport	uber
i need to get four people to red lobster; can you order me an uber	uber
can i get an uber for 4 to the mall	uber
can you get me an uber to disney world	uber
i need an uber that will accommodate eight people to go to the closest amc theater	uber
i want to reserve an uber to go to the airport	uber
i'm going to need to book an uber to universal studios	uber
please book me an uber and enter destination penn station, new york	uber
are there any ubers available that fit 5 people we are going to wendys	uber
book an uber for 6 people to go to the movies	uber
schedule an uber to pick me up at home in an hour	uber
i need an uber to take me to the mall	uber
i need an uber ride to come and pick me up now at work	uber
can i get an uber for myself to the grocery store	uber
i am stranded and need uber	uber
please order an uber for me to go to the zoo	uber
can you send me an uber to go to a restaurant in downtown phoenix	uber
can you get me an uber to the science museum	uber
ai i need to go to charlies with eight adults can you get uber	uber
book uber from here to downtown	uber
please call an uber for me	uber
get an uber to the airport	uber
find me an uber to the liberty bell	uber
i need an uber for 5 people to go to the statue of liberty	uber
can i get an uber for five people to go to the national gallery of art	uber
get an uber to pick me up at work and take me home	uber
call an uber to mark's house	uber
call me an uber please	uber
call an uber to take a group of 4 from this bar to the one on maple st	uber
i need an uber for 2 for orlando	uber
get me an uber to chilis	uber
i need to get an uber for three people to go to the zoo	uber
i need an uber to come to my work at 5pm for three people going to the cineplex downtown	uber
book a 6 person uber to the movies	uber
i need an uber to the doctor	uber
book me an uber for a party of 5 to the salvage yard off maple	uber
book an uber suitable for seating 5 individuals and headed for the mall	uber
i'm going to the movies book an uber for 6 people	uber
what should i do now that my car battery is dead	jump_start
tell me how to jump start my own car battery	jump_start
i want a pic of how to jump start	jump_start
do you have instructions on jump starting a chevy	jump_start
how can i start my car using a jump start	jump_start
show me the way to jump start a battery	jump_start
i need to know how jumping a car works	jump_start
will you guide me through the process to jump start my car, please	jump_start
show me instructions on how to jump start my car	jump_start
what do i need to jump start a battery	jump_start
what do i need to do now that my battery is dead	jump_start
i have to jump start my car	jump_start
what are some ways to jump start a car	jump_start
inform me on the directions to jump start my car	jump_start
my car is dead, what do i need to jump start it	jump_start
i really need to jump start my car	jump_start
what's the method of jumping my car	jump_start
what are my options for jump starting my battery	jump_start
what is the process for jump starting my car	jump_start
tell me the tools i need to jump start my car	jump_start
what is the way to jump start the car	jump_start
what do i do to fix a dead car battery	jump_start
read me a step by step guide on jump starting cars	jump_start
how do i do a jump start on my car	jump_start
my car needs to be jump started, guide me through it	jump_start
hey do you know how to jump start a car battery	jump_start
what prong jump starts the car	jump_start
my car is dead can you tell me how to jump start it	jump_start
who can jump off my dead car battery	jump_start
how can i jump start my car	jump_start
i wanna know how to jump start my car	jump_start
how can i charge my car battery when it's dead	jump_start
pull up instructions on how to jump start a car	jump_start
my car battery is dead, what do i do now	jump_start
look up instructions for jumper cables	jump_start
i need to jump start my car what do i do	jump_start
my car battery is dead, how do i charge it	jump_start
how do i jump start my battery	jump_start
what do i need to do to get my car jump started	jump_start
if my car battery is dead, what action do i need to do	jump_start
whats the safest way to jump start a car	jump_start
how can i jump start a car	jump_start
what can i do since my car battery died	jump_start
what is the way to jump start my car	jump_start
what do i do to jump start my battery	jump_start
my car battery has died what should i do now	jump_start
what do i do if my car battery is dead	jump_start
find repair shop that will diagnosis dead car battery	jump_start
how should i proceed if my car won't start and i think it's the battery	jump_start
my battery is dead so how can i get it going again	jump_start
how do i properly give my car a jump	jump_start
i need instructions on how to jump start my car	jump_start
how can i replace my car battery	jump_start
what steps should be taken to jump start a car	jump_start
how does one jump a car	jump_start
how do you go about jump starting a car battery	jump_start
where should i go to get my dead car battery checked out	jump_start
can you tell me how to jump a car	jump_start
if i think my car battery is dead, what steps should i take to fix it	jump_start
i need instructions to walk me through jump starting my car	jump_start
how might i go about jump starting a car	jump_start
what will i need to jump start a dead car	jump_start
can i get my car jumped for this dead battery	jump_start
please give me a quick tutorial on jump starting my car	jump_start
i'm almost certain my car battery died, please tell me what to do	jump_start
what do i do now that my battery is dead	jump_start
what do you need to jump a car	jump_start
how to jump start a car	jump_start
i'm not sure how to jump start a car; can you help me	jump_start
how do i give my car a jump	jump_start
please help me figure out how to jump start my car	jump_start
how do you do a jump start	jump_start
how do i start my car battery	jump_start
explain how to jump a car	jump_start
i would like to jump start my car	jump_start
i would appreciate it if you could show me how to jump start a car battery	jump_start
can you give me instructions on how to jump start my car, please	jump_start
how do you jump a car with a dead battery	jump_start
how do i jump my car	jump_start
tell me how to jump start my car	jump_start
i don't know how to jump start my car	jump_start
i need to do something about my dead car battery	jump_start
help me jump start my car	jump_start
do i need cables to jump start my car	jump_start
how do i jump start my vehicle	jump_start
whats the best way to jump start a battery	jump_start
what steps do i need to take to jump start my car	jump_start
where to go to get dead car battery tested	jump_start
what do i do if i suspect my car battery is dead	jump_start
teach me how to jump start my car	jump_start
i need your help to jump start this car battery	jump_start
can you tell me how to jump my car	jump_start
what is the procedure to jump start a car	jump_start
how do you jump start a subaru forester	jump_start
i believe that my car battery has died, what do i do next	jump_start
do i need jumper cables for my dead car battery	jump_start
my battery died in my car, how can i jump start a battery	jump_start
there is no juice in my battery please help	jump_start
my car battery died, what should i do	jump_start
help needed to jump start my car	jump_start
tell me how to jump start a battery	jump_start
tell me how to jump start my dead battery	jump_start
i need rules for jump starting	jump_start
please assist me in figuring out how to handle a dead car battery	jump_start
what do i do if my car battery died	jump_start
how do i jump start my car battery	jump_start
my car needs a jump start; what do i need to do	jump_start
what do i do if i think my car battery's dead	jump_start
what can i do to jump start my car	jump_start
what's the best way to jump start a kia	jump_start
my car needs jump started, find me directions	jump_start
i need diy info about jump starting my dead car battery	jump_start
what should i do if my car battery dies	jump_start
what shall i do now that my battery is dead	jump_start
what do i do to jump start my car	jump_start
i need to know how to get my car jump started	jump_start
how do i jump start a battery	jump_start
what do i do when my car battery is dead	jump_start
what do i need in order to jump start my car	jump_start
what's next when it seems there's a dead car battery	jump_start
find my current location	current_location
check me out on the map	current_location
use the map and pinpoint my position	current_location
latitude and longitude please	current_location
how do i know where i'm at	current_location
what's the precise coordinates of this place	current_location
where am i currently	current_location
can you find the exact address for where i am currently	current_location
check out my location up on the map	current_location
what is my location right now	current_location
can you find my location on the map	current_location
what location do you see me at right now	current_location
my current location is what	current_location
whats my location	current_location
show me where i am on the map please	current_location
would you find my location on the map, please	current_location
show my position on the map	current_location
can you find my location on the map, please	current_location
how can i find my current location	current_location
where is my location	current_location
please show me where i am on a map	current_location
i'm lost	current_location
location currently, where	current_location
show me my location	current_location
where am i on gps	current_location
is there a way to get my current location	current_location
where am i	current_location
can you tell me my current location	current_location
where am i currently located	current_location
what are the gps coordinates where i am located	current_location
where exactly am i at the moment	current_location
talk to me about where im at right now	current_location
how can i go about finding my location right now	current_location
what street am i on right now	current_location
where are we located	current_location
what location is this	current_location
i'd like to know where i am	current_location
what are my gps coordinates at this location	current_location
tell me where i am	current_location
give me my gps coordinates	current_location
what country and city am i in	current_location
how can i tell what my current location is	current_location
could you find my location on the map	current_location
tell me the current location	current_location
i need to know my location	current_location
i need to know my current gps coordinates	current_location
can you tell me where i am	current_location
show me where i am on the map	current_location
i would like to know my current location	current_location
how will i find my current location	current_location
find out where i am on the map	current_location
tell me my current gps coordinates	current_location
what do i do to find my current location	current_location
what do i do to find my location	current_location
pass me my gps coordinates	current_location
how do i find my location right now	current_location
how can i locate where i am	current_location
in the place i am what are my gps coordinates	current_location
what is this place	current_location
i am in need of my location	current_location
i would like to know my location	current_location
can you tell me the address where i am right now	current_location
display my location on a map	current_location
look me up on the map	current_location
what are the gps coordinates of this spot i am at right now	current_location
how do i find my location right now, please	current_location
where exactly am i	current_location
where am i right this moment	current_location
where am i on the map	current_location
what are my longitude and latitude points	current_location
tell me my current location please	current_location
how can i go about finding my current location	current_location
would you please tell me my current gps coordinates	current_location
give me my current location	current_location
how do i find my location, please	current_location
how shall i find my current location	current_location
i need to find out how i know my location right now	current_location
show me where i am	current_location
can you show me where i am on a map	current_location
what could help me locate myself	current_location
give me my location	current_location
what's my current location	current_location
where am i located	current_location
how do i find my present location right now	current_location
where am i located on the map	current_location
please tell me my location using gps	current_location
can i have my current gps coordinates	current_location
can you locate me on a map	current_location
i want to see my location on the map	current_location
you need all five answers	current_location
check maps for my location	current_location
tell me my current location	current_location
please tell me the current location	current_location
i do not know where i am	current_location
what's my map location	current_location
let me know where i'm located	current_location
where is my current location	current_location
i am currently located in what town	current_location
i need to know my present gps coordinates	current_location
look my location up on the map	current_location
please tell me the address of my current location	current_location
please tell me my present gps coordinates	current_location
tell me how to find my current location	current_location
can you tell me my location	current_location
let me know my current location	current_location
