text	label
how long should i fry an egg for	cook_time
how long do i need to cook pot au feu for	cook_time
about how long should you cook lasagna	cook_time
how long does it take to prepare a lasagna	cook_time
how long do i cook chicken breast	cook_time
how long does it take to make pho	cook_time
when can i expect meal of salmon to be finished	cook_time
how long do i cook steak	cook_time
how long do the brownies have to cook	cook_time
how long do i boil eggs	cook_time
how long to cook a frozen pizza	cook_time
how long does it take to prepare pot roast	cook_time
how long should i cook country fried potatoes for	cook_time
so how long do you think the chicken will take	cook_time
how long does pizza take	cook_time
should i cook this for a long time	cook_time
tell me how long i will need to spend preparing a meat loaf dish	cook_time
i want to cook a lasagna please tell me how long it will take	cook_time
how long do i need to cook lasagne for	cook_time
how long does it take to make shrimp scampi	cook_time
how long does a roast take	cook_time
what is the prep time for a 10 lb turkey	cook_time
how long do you need to bake chicken for it to be safe to eat	cook_time
how long does pizza take to cook	cook_time
how long do i need to cook beef stew for	cook_time
look up recipe time for this	cook_time
about how long should you cook a 10 pound turkey	cook_time
how long should i cook a ny steak	cook_time
what is the duration of time cookies should be in the oven	cook_time
how long will it take to make an omelet	cook_time
how long will it take to cook a lasagna	cook_time
how long does it take to make lasagna	cook_time
how long should i bake the brownies for	cook_time
how long do i put the casserole in	cook_time
what time should i cook noodles for	cook_time
how long should i cook carnitas for	cook_time
how long do i need to cook chili for	cook_time
tell me how long i ought to spend preparing fajitas	cook_time
how long must i cook spaghetti for	cook_time
what's the average cooking time for cooking wings	cook_time
how long does it take to cook hot pockets	cook_time
bake time for brownies	cook_time
what should i put on the timer to cook this dish	cook_time
how long to microwave a frozen dinner	cook_time
how long should i bake a cake	cook_time
how long will it take me to make baked chicken	cook_time
how long does it take to cook steaks	cook_time
how long should i wait before i can bake bread with homemade dough	cook_time
how long should i cook ham for	cook_time
how long does it take to cook meal of tuscan	cook_time
what is the proper time to cook steak for	cook_time
how long should i microwave hot pockets for	cook_time
how long do i need to cook tuna casserole for	cook_time
how long should i expect beef stroganoff to prepare	cook_time
what is the proper cooking time for this	cook_time
how many minutes should i put meal the cake in the oven	cook_time
how long does it take to cook roast beef	cook_time
what is the necessary amount of time required to prepare pot roast	cook_time
how long will the chicken take to cook	cook_time
can you tell me how long it will take to cook a lasagna	cook_time
how long to cook steak for	cook_time
how long should i cook a spiral ham	cook_time
how long will it take to make the wings	cook_time
i need to know how long to cook chicken for	cook_time
how long should this be in the oven	cook_time
lasagna takes how long to cook	cook_time
how long should i cook the cookie dough	cook_time
how long do i cook the chicken roast	cook_time
how long does it take to make roast chicken	cook_time
how long should i boil eggs	cook_time
how long to i bake the brownies	cook_time
how many minutes to melt cheese	cook_time
how long should i boil noodles for	cook_time
how long is it acceptable to carmelize onions	cook_time
what's the prep time for a garden salad	cook_time
how long do i put sugar cookies in for	cook_time
how long do i cook this dish of rice	cook_time
i need to know the preparation time required for fried chicken	cook_time
how long should i spend preparing roast beef	cook_time
how many minutes are involved in the preparation of curry	cook_time
how long do you cook pasta for	cook_time
how long do i need to make lasagne	cook_time
what's the recommended cooking time for steak	cook_time
how long will the turkey take to cook	cook_time
how long should i cook pho for	cook_time
what's the usual time for tuna casserole	cook_time
i want to bake brownies, how long do they bake for	cook_time
how long should i cook the asparagus for	cook_time
how long do noodles need to cook	cook_time
how much time does it take to boil an egg	cook_time
how long does it take to make mashed potatoes	cook_time
how long should i cook a steak for	cook_time
how long should i cook chicken thighs	cook_time
how long do you cook a salmon	cook_time
how long should i cook the steak for	cook_time
how long does it take pork to cook	cook_time
tell me how long it will take to prepare a lasagna	cook_time
what's the prep and cooking time on pizza dough	cook_time
how long should i cook chicken	cook_time
how many minutes do i cook baked ziti	cook_time
how long is the chicken gonna take	cook_time
what's the cooking time for chicken alfredo	cook_time
how long should i cook the ham for	cook_time
if i cook the pizza at 400 degrees how long must it be in for	cook_time
the steak must go under the broiler for how long	cook_time
how long should a cake bake	cook_time
how long do i cook this for	cook_time
how long do i need to cook chicken	cook_time
how long should i cook roast for	cook_time
how long do you bake a cake	cook_time
i need to know how long to do a pot roast in a slow cooker	cook_time
how long do i cook pork	cook_time
how long should i cook the eggs for	cook_time
how long to reheat chinese food	cook_time
how long does it take to bake a pork loin	cook_time
how much time do i need to prepare chicken	cook_time
how long to grill thick steaks	cook_time
how long do you need to put the cuish in for	cook_time
for how long should i bake the brownies	cook_time
how long does it take to cook a pork chop	cook_time
how many calories are in oranges	calories
how many calories are in a bag of regular doritos	calories
rolls have how many calories	calories
how many calories should i plan to be in a donut	calories
can you tell me the amount of calories i can expect one tuna sandwich to contain	calories
can you tell me the calorie count in a glazed donut	calories
what is the calorie content of a scoop of chocolate ice cream	calories
inform me of the calorie content of vanilla ice cream	calories
how many calories on average are in a hot dog	calories
can you tell me the calories for the cheeseburger	calories
how many calories does a big mac have	calories
i need to know the total calories for a chicken caesar salad	calories
how many calories in chicken	calories
calorie content of dr pepper	calories
please tell me how many calories one chocolate bar contains	calories
how many calories are in cheerios	calories
what is the total number of calories in a bag of potato chips	calories
how many calories are in a large fry	calories
what is the total number of calories in this pizza	calories
how many calories are in a sandwich	calories
what's the amount of calories in an cream filled oatmeal cookie	calories
what is the calorie count for muffins	calories
how many calories are in a burger	calories
what's the expected calories in a cream filled cookie	calories
what's the amount of calories in a cheesy omelette	calories
do you know the calorie content of a strip of bacon	calories
how many calories do cheetos have	calories
how high in calories is pork	calories
what is the calorie content in bananas	calories
cookies have how many calories	calories
2 cups of grapes have how many calories	calories
are there a lot of calories in muffins	calories
can you check the amount of calories in a chicken sandwich	calories
i need to know the calorie count of a bacon cheeseburger	calories
i want the calorie content for a banana	calories
what is the calorie count of an apple	calories
what type of calorie numbers are in onions	calories
i'd like the calories for this chicken breast	calories
what is the caloric total in these muffins	calories
how many calories are in a serving of deans french onion dip	calories
tell me the calorie content of frosted flakes	calories
what's the caloric content if you eat roast beef	calories
how many calories are in mashed potatoes	calories
how many calories would i consume if i ate a loaded hotdog	calories
what is the calorie content in french fries	calories
can you see how many calories are in cream of mushroom soup	calories
what's the calorie content of chicken nuggets	calories
how many calories are in a can of coke	calories
i need to know the number of calories on average in a handful of pistachios	calories
can you tell me how many calories are in cookies	calories
what kind of calories do chicken tenders have	calories
tell me the number of calories in a banana	calories
what is the calorie content of a small bag of lay's potato chips	calories
calorie check, cheese burger	calories
can you provide me the calories in the smoothie	calories
how many calories in scoop of chocolate ice cream	calories
i need to know the calorie content in a piece of pepperoni pizza	calories
what amount of calories are in one muffin	calories
what's the calorie info for 2 cups of regular chex mix	calories
tell me how many calories in a medium size apple	calories
what number of calories are in a pizza	calories
what is the calorie content in potatoes	calories
if i ate a cookie, how many calories would i be ingesting	calories
what is the calorie content in spaghetti	calories
how many calories are in a cookie	calories
how many calories are in an apple	calories
looks up the calories in cheetos	calories
in one cookie, how many calories would i find	calories
how many calories are in cookies	calories
number of calories in coke	calories
what's the calorie content for fried eggs	calories
how many calories does two bananas have	calories
hoq many calories does pasta have	calories
how much is alorie intake	calories
pocki sticks has how many calories	calories
in a fried egg, how many calories are there	calories
i need to know the calorie content of spaghetti	calories
what is the calorie going to be if i'm eating cereal	calories
what's the calorie content of cheetos	calories
how many calories are in a bowel of wheaties	calories
how many calories are in a cheeseburger	calories
what is the calorie look like in apples	calories
the intake of calories it it bad	calories
what's the number of calories in a pepsi	calories
calorie count of cheetos	calories
how many calories in peanuts	calories
what's the caloric content in a bowl of rice crispies with milk	calories
what is the number of calories in a steak	calories
how many calories are in apples	calories
a bowl of cheerios with milk has how many calories	calories
how many calories are in chocolate cake	calories
what is the amount of calories that scrambled eggs has	calories
what does a sausage sandwich have for calories	calories
whats the calorie content of oatmeal	calories
how many calories are in waffles	calories
how many calories in meatloaf	calories
tell me the calorie content of an apple	calories
how many calories are in a taco	calories
what's the calorie count for tuna casserole	calories
how many calories in gum	calories
how many calories does a scoop of chocolate ice cream have	calories
add up the calories in tacos	calories
how many calories are in spaghetti and meat sauce	calories
how many calories are in a ghirardelli sea salt caramel candy	calories
what is the calorie count of a burrito	calories
how many calories in this slice of pizza	calories
how many calories are in chicken breast	calories
what is the calorie count for this milkshake	calories
look up the calories in an apple	calories
what about the calories for this chicken salad	calories
how many calories are in oreos	calories
how many calories are in a donut hole	calories
how many calories does an orange have	calories
what's the calorie content of french fries	calories
how many calories are in cake	calories
how many calories are there in a scoop of chocolate ice cream	calories
a large french fry has how many calories	calories
what's a big bowl of ice cream contain in calories	calories
how many calories are in ice cream	calories
what is the calorie count for one cookie	calories
let me pick your brain what do you think we should do for dinner tonight	meal_suggestion
i need you to give me a suggestion for what to make for dinner	meal_suggestion
please suggest a meal from italy to me	meal_suggestion
i need a mexican meal suggesstion	meal_suggestion
what's a good italian meal	meal_suggestion
i need to cook, what should i make	meal_suggestion
what kind of meal should i eat from thailand	meal_suggestion
i would like thai food	meal_suggestion
what can i make for dinner using ground beef	meal_suggestion
can you give me a vietnamese meal suggestion, please	meal_suggestion
what would be good for dinner	meal_suggestion
give recommendations for thai food	meal_suggestion
can you give me a meal suggestion from the south	meal_suggestion
may you suggest a meal from italy to me	meal_suggestion
what are good thai dishes	meal_suggestion
what do you think i should prepare for my dinner	meal_suggestion
i want to try a meal from ireland	meal_suggestion
any recommendations for a greek dinner	meal_suggestion
i'm needing dinner suggestions for mexican food	meal_suggestion
i need new dinner ideas	meal_suggestion
what's a good, popular american meal	meal_suggestion
can you give me a burmese meal suggestion, please	meal_suggestion
can you give me a chinese meal suggestion	meal_suggestion
suggest a meal from germany to me	meal_suggestion
can you suggest a meal from ireland for me	meal_suggestion
do you have any suggested roman recipes	meal_suggestion
can you give me a american dinner suggestion	meal_suggestion
what should i have for dinner	meal_suggestion
any suggestions for a peruvian meal	meal_suggestion
i want to eat something from turkey	meal_suggestion
please give me a suggestion for what to make for dinner	meal_suggestion
help me find some new dinner recipes	meal_suggestion
i would like to hear what ideas you have about making dinner tonight	meal_suggestion
help me decide what mexican meal i want	meal_suggestion
suggest a meal from korea to me	meal_suggestion
i would love an italian meal suggestion	meal_suggestion
can you suggest meals from italy to me	meal_suggestion
suggest a meal from denmark to me	meal_suggestion
i'm looking for a meal that's from the asian cuisine	meal_suggestion
i really want an italian meal suggestion	meal_suggestion
what type of pizzas are available for dinner	meal_suggestion
got any good dinner ideas	meal_suggestion
what's the pizza like around here	meal_suggestion
can you give me a vietnamese meal suggestion	meal_suggestion
suggest a meal from burma to me, please	meal_suggestion
do you know what is for dinner	meal_suggestion
what should i get at a mexican restaurant	meal_suggestion
suggest a meal from burma to me	meal_suggestion
i need to know what's good for chinese around here	meal_suggestion
i need an italian meal suggestion	meal_suggestion
suggest a meal from new york to me	meal_suggestion
suggest something for me to make myself for dinner	meal_suggestion
what kind of greek food is good for dinner	meal_suggestion
do you know any greek dishes i could make for dinner	meal_suggestion
i'm feeling like a greek meal and need some suggestions	meal_suggestion
i need to quick dinner suggestions	meal_suggestion
what would you say is a good german dinner idea	meal_suggestion
what should i make for dinner	meal_suggestion
please suggest meals from italy to me	meal_suggestion
what would you suggest for japanese	meal_suggestion
which mexican meal would be good	meal_suggestion
whats a good chinese dinner suggestion	meal_suggestion
suggest a meal from thailand to me, please	meal_suggestion
please suggest a chinese meal	meal_suggestion
how tasty is the pizza here	meal_suggestion
i need some ideas for a mexican meal	meal_suggestion
give me italian meal ideas	meal_suggestion
do you know an good pasta dishes	meal_suggestion
do you have any good recommendations for swiss cuisine	meal_suggestion
suggest food from italy to me	meal_suggestion
i need options or italian tonight	meal_suggestion
do you have any recommendations for korean	meal_suggestion
what kind of indian would you recommend	meal_suggestion
what can i make for dinner	meal_suggestion
i am bored and need new dinner recommendations	meal_suggestion
do you have any suggestions for a meal from australia	meal_suggestion
i want a meal from vietnam to be suggested to me	meal_suggestion
i need an idea for a french dinner	meal_suggestion
i need a good meal idea from italy	meal_suggestion
i'd like a meal suggestion from thailand	meal_suggestion
i want an italian meal suggestion	meal_suggestion
what meal from italy do you suggest	meal_suggestion
do you have any suggestions as to what i should cook for dinner	meal_suggestion
what peruvian dish should i make	meal_suggestion
i need an italian dinner idea	meal_suggestion
get me italian cuisine dinner suggestions	meal_suggestion
what's the best pizza place around here	meal_suggestion
do you have any southern dishes to recommend	meal_suggestion
what do you think i should make for dinner	meal_suggestion
please provide an option for dinner	meal_suggestion
what's a simple chinese recipe for dinner	meal_suggestion
need some good dinner ideas	meal_suggestion
can you give me a meal suggestion for swedish cuisine	meal_suggestion
what would you say is the best meal to have for dinner	meal_suggestion
i want you to give me a suggestion for what to make for dinner	meal_suggestion
i would like you to suggest a chinese dish	meal_suggestion
i'd like to get dinner suggestions for thai food	meal_suggestion
can you give me a thai dinner suggestion	meal_suggestion
what food from italy do you suggest	meal_suggestion
can you recommend for me a dish from ethiopia	meal_suggestion
please suggest a british meal for me	meal_suggestion
tell me what to make for dinner	meal_suggestion
suggest a good mexican meal to me	meal_suggestion
i need a suggestion for a dinner recipe	meal_suggestion
can you give me a thai meal suggestion, please	meal_suggestion
what's a good french meal	meal_suggestion
suggest a meal from thailand to me	meal_suggestion
can you recommend thai food	meal_suggestion
thinking about cooking dinner, what should i make	meal_suggestion
i need some good suggestions for peruvian cuisine	meal_suggestion
suggest a meal from thailand please	meal_suggestion
i'm looking for a good suggestion for norse cuisine	meal_suggestion
indian cuisine suits me and i'd like a meal suggestion, please	meal_suggestion
can you tell me a good indian dish to make	meal_suggestion
can you give me a thai meal suggestion	meal_suggestion
i need a thai food suggestion	meal_suggestion
tell me what meal to eat from texas	meal_suggestion
suggest a meal from laos to me, please	meal_suggestion
i'd like you to give me an idea for a meal from iceland	meal_suggestion
i'm looking for italian food suggestions	meal_suggestion
which ingredients does gumbo have	ingredients_list
what do you use when you make a chef's salad	ingredients_list
give me a list of ingredients for making pasta	ingredients_list
what do i need to make chicken salad	ingredients_list
let me know what ingredients i need to make pasta	ingredients_list
what ingredients are in cheese cake	ingredients_list
what do i need to make chicken noodle casserole	ingredients_list
what ingredients do i need to make pizza	ingredients_list
what do you purchase to put in a shepherd's pie	ingredients_list
tell me the ingredients to make an apple pie	ingredients_list
what is gumbo made of	ingredients_list
for peppercorn steak, what ingredients do i need	ingredients_list
whare the ingredients for the stir fry	ingredients_list
i want to cook a quick breakfast what ingredients do i need	ingredients_list
what ingredients do i need for shrimp scampi	ingredients_list
which ingredients are in pizza	ingredients_list
what ingredients do i need to make broccoli cheddar soup	ingredients_list
show me the recipe for broccoli cheddar soup	ingredients_list
what kind of ingredients go into the chicken a la king	ingredients_list
what ingredients are in coffee cakes	ingredients_list
what ingredients do i use for pork belly	ingredients_list
what is needed to make lasagna	ingredients_list
what do you i need to make pizza dough	ingredients_list
find list of ingredients i would need to bake a funnel cake	ingredients_list
what ingredients are required for chicken noodle soup	ingredients_list
pull up everything i need to make a pasta dish	ingredients_list
please give me a list of the ingredients contained in chocolate cupcakes	ingredients_list
what do i need to make authentic kimchi	ingredients_list
what are all of the ingredients for brownies from scratch	ingredients_list
what do i need to make a cake	ingredients_list
what ingredients do i need for tacos	ingredients_list
what do i need to use to make lasagna	ingredients_list
give me a list of ingredients needed for pizza dough	ingredients_list
for pasta primavera, what ingredients will i use	ingredients_list
what ingredients are in chips	ingredients_list
tell me all the things i need to buy to make pasta	ingredients_list
what ingredients go in pizza	ingredients_list
what ingredients are present in marshmallows	ingredients_list
what ingredients are needed for shrimp cocktail	ingredients_list
what are the ingredients used in chicken curry	ingredients_list
what ingredients are in beef jerkey	ingredients_list
can you tell me what ingredients are needed for cinnamon buns	ingredients_list
what ingredients do i need to bake a cake	ingredients_list
in terms of making scrambled eggs, what ingredients do i need	ingredients_list
what does subway use to make a cold cut combo	ingredients_list
what are the ingredients in gumbo	ingredients_list
what ingredients are in sushi	ingredients_list
tell me the ingredients for making tom yum	ingredients_list
give me a recipe for tacos	ingredients_list
what ingredients are in spinach dip	ingredients_list
what ingredients are necessary for a steak	ingredients_list
what do i need to make brownies	ingredients_list
what are the ingredients to make shepherd's pie	ingredients_list
what kind of stuff is in potato salad	ingredients_list
what ingredients are in tacos	ingredients_list
i'll use what ingredients for lasagna	ingredients_list
what ingredients are necessary to make spaghetti carbonara	ingredients_list
what do i need to buy to make pierogi	ingredients_list
please search for necessary ingredients included in meatballs	ingredients_list
i need what ingredients for meatloaf	ingredients_list
what's a good recipe foe tacos	ingredients_list
what ingredients go in a milky way	ingredients_list
what do you mix to make a chocolate cake	ingredients_list
what do you need to make pancakes	ingredients_list
what do i need if i want to make lasagna	ingredients_list
pizza has which ingredients	ingredients_list
what do i need to cook chicken soup	ingredients_list
what ingredients are in filet mignon	ingredients_list
what would i need if i wanted to make chicken marsala	ingredients_list
what ingredients do i need to make raisin bread	ingredients_list
what is the ingredient list for an omelette	ingredients_list
what goes into chicken noodle casserole	ingredients_list
what does it take to make buttermilk pancakes	ingredients_list
what ingredients do i need to make egg salad	ingredients_list
what ingredients are in mashed potatoes	ingredients_list
what ingredients do i need to make salmon salad	ingredients_list
what am i gonna need for sushi	ingredients_list
the ingredients in pizza are which ones	ingredients_list
what ingredients are needed to make lasgana	ingredients_list
tell me the ingredients in pizza	ingredients_list
what do i need to make pasta	ingredients_list
ingredients needed to make a mexican lasagna	ingredients_list
list the ingredients in pizza	ingredients_list
what are the ingredients of spaghetti	ingredients_list
how much flour do i need for a strawberry cake	ingredients_list
what ingredients are found in hunan chicken	ingredients_list
what ingredients are in dough	ingredients_list
do you know the ingredients used in homemade chicken soup	ingredients_list
what do i need to get to make lasagne	ingredients_list
please list ingredients for broccoli cheddar soup	ingredients_list
what ingredients do i need to make pancakes	ingredients_list
tell me what ingredients i need for carne asada	ingredients_list
what ingredients do you need to make lasagna	ingredients_list
what ingredients are in sugar cookies	ingredients_list
what ingredients do i need to make spaghetti	ingredients_list
i am making broccoli cheddar soup, what ingredients do i need	ingredients_list
what ingredients do i need for gumbo	ingredients_list
what ingredients go in potato skins	ingredients_list
what do you put in chicken noodle casserole	ingredients_list
what do i need to buy for spaghetti	ingredients_list
the ingredients in pizza are what	ingredients_list
i’m making spaghetti what ingredients do i need	ingredients_list
tell me what ingredients i will need to make this meal	ingredients_list
how can i make my own doughnuts/what ingredients	ingredients_list
what should i get to make the jamaican patties	ingredients_list
what ingredients does agor agor need	ingredients_list
