text	label
i need a list of ingredients required to make lamb stew	ingredients_list
what ingredients go in mashed potato	ingredients_list
can you tell me the ingredients used in pasta sauce	ingredients_list
what stuff would i need to make tortellini	ingredients_list
what do i need to make a cajun chili	ingredients_list
what goes into a strawberry smoothie	ingredients_list
what do you need to make general tsao's chicken	ingredients_list
what do i need to make macaroni	ingredients_list
what should i grab to make a german chocolate cake	ingredients_list
what ingredients do i need for philly cheesesteaks	ingredients_list
what do you need to make dandelion wine properly	ingredients_list
what food do you need to make lasagna	ingredients_list
i need to know what ingredients are in a french baguette	ingredients_list
i want to make a meat stew what ingredients do i need	ingredients_list
what are some good southern bbq restaurants in nashville	restaurant_suggestion
can you suggest some quality chinese restaurants in oklahoma city	restaurant_suggestion
name a good restaurant near me	restaurant_suggestion
i need reviews for places serving tacos in chicago	restaurant_suggestion
could you suggest a french restaurant, please	restaurant_suggestion
please find me some good thai restaurants in new york city	restaurant_suggestion
where should i go for food tonight	restaurant_suggestion
suggest a restaurant for me to eat tonight, please	restaurant_suggestion
in boston, what are the best pizza places	restaurant_suggestion
give me a list of places that serve the best wings in charlotte	restaurant_suggestion
i need to know what restaurants are near me	restaurant_suggestion
i want sushi, is there any good place in ho chi minh	restaurant_suggestion
help me find a good sushi spot in chicago	restaurant_suggestion
i want to eat mediterranean fare with at least four stars, near me	restaurant_suggestion
i feel like going out for sushi tonight who in the area serves good sushi	restaurant_suggestion
could you locate me some good places in kentucky that serve sushi	restaurant_suggestion
suggest some restaurants	restaurant_suggestion
are there any decent places to get seafood in seattle	restaurant_suggestion
what are some good places in kentucky that serve sushi	restaurant_suggestion
what are some good mexican restaurants in indianapolis	restaurant_suggestion
show me some restaurants that have high reviews for eating out	restaurant_suggestion
its date night and we cant decide where to go help	restaurant_suggestion
tell me some good mexican restaurants in dallas	restaurant_suggestion
i want to go out to eat but have no idea where to go, do you know of any places	restaurant_suggestion
help me pick a nice restaurant to dine at	restaurant_suggestion
are there some good thai restaurants in san antonio	restaurant_suggestion
can you list off 4 star restaurants	restaurant_suggestion
what are the best italian restaurants in chicago	restaurant_suggestion
any good pizza restaurants around here	restaurant_suggestion
where do people go to eat in this town	restaurant_suggestion
what's a highly rated place for steak in omaha	restaurant_suggestion
are there decent seafood restaurants in portland	restaurant_suggestion
i need some suggestions for dinner places tonight	restaurant_suggestion
i need a list of good places to eat near me	restaurant_suggestion
where can i go to eat	restaurant_suggestion
give me some restaurant suggestions	restaurant_suggestion
where should i eat	restaurant_suggestion
do you know of any good mexican restaurants in seattle	restaurant_suggestion
what are some good ethiopian restaurants in queens	restaurant_suggestion
can you suggest a restaurant for me to eat tonight	restaurant_suggestion
where can i get some good food	restaurant_suggestion
are there are any good places in washington that serve cheese pizza	restaurant_suggestion
can you find a good steakhouse for tonight	restaurant_suggestion
are there any good places in cleveland that serve clams	restaurant_suggestion
do you know any good restaurants good for kids	restaurant_suggestion
give me some good restaurants	restaurant_suggestion
what are good places for a burrito in albuquerque	restaurant_suggestion
please list nearby restaurants with 4 or more star reviews	restaurant_suggestion
what are the best restaurants	restaurant_suggestion
does cleveland have any good places that serve clams	restaurant_suggestion
what are the best places to get shrimp in chicago	restaurant_suggestion
can you recommend a decent place in chicago to get pizza	restaurant_suggestion
can you find any good places in cleveland that serve clams	restaurant_suggestion
what's your recommendation for dining out tonight	restaurant_suggestion
where do you want to eat tonight	restaurant_suggestion
can you suggest a thai restaurant, please	restaurant_suggestion
what's a good place to eat chinese in san francisco	restaurant_suggestion
what are some good sushi restaurants in reno	restaurant_suggestion
can you list off different restaurants	restaurant_suggestion
where is your favorite restaurant to eat	restaurant_suggestion
i am hungry and need a restaurant suggestion	restaurant_suggestion
list a few pizza places that have seating near my current location	restaurant_suggestion
are there any vegan restaurants in my town	restaurant_suggestion
could you direct me to any good places in kentucky that serve sushi	restaurant_suggestion
find an indian restaurant	restaurant_suggestion
where should i go to eat tonight	restaurant_suggestion
does kentucky have any good restaurants that serve sushi	restaurant_suggestion
find me a new place for dinner	restaurant_suggestion
are there any sushi restaurants in reno that have good reviews	restaurant_suggestion
where can i pick up a good burger near where i am	restaurant_suggestion
any fantastic restaurants to get shrimp at in atlanta	restaurant_suggestion
can you recommend an indian restaurant	restaurant_suggestion
in cleveland, are there any good places that serve clams	restaurant_suggestion
do you have any restaurant recommendations	restaurant_suggestion
what are the best sushi restaurants in reno	restaurant_suggestion
what's the food can easily get in canada	restaurant_suggestion
can you tell me the best place for cajun shrimp in tampa	restaurant_suggestion
any ideas on a good place to eat out	restaurant_suggestion
can you recommend any restaurants	restaurant_suggestion
what type of restaurants are nearby	restaurant_suggestion
do you know of any good restaurants	restaurant_suggestion
is there any good place for vietnamese food on the east side of the island	restaurant_suggestion
what are some good itialian restaurants in north salem	restaurant_suggestion
recommendations for good thai restaurants in las vegas	restaurant_suggestion
what restaurants are pet friendly near here	restaurant_suggestion
i'm not going to cook today, can you suggest a restaurant	restaurant_suggestion
is there a barbecue restaurant around here	restaurant_suggestion
give me restaurant reccomendations	restaurant_suggestion
i want you to recommend a good local restaurant to me	restaurant_suggestion
can i get good tacos anywhere in austin	restaurant_suggestion
is there any good place in hawaii for pasta	restaurant_suggestion
are there any good chinese restaurants open right now	restaurant_suggestion
find me an asian restaurant	restaurant_suggestion
what's a good restaurant nearby	restaurant_suggestion
i'm famished so give me some places to eat!	restaurant_suggestion
can you find me a good restaurant to try eating at	restaurant_suggestion
what's the best place for some thai in new york city	restaurant_suggestion
pull up some recommendations for places serving fish in maine	restaurant_suggestion
suggest a few local eateries in mid price range	restaurant_suggestion
i am looking for good southeast asian restaurants in philadelphia	restaurant_suggestion
tell me where to go since i want to eat out tonight	restaurant_suggestion
where should i go for good thai food in las vegas	restaurant_suggestion
where are some good thai restaurants in las vegas	restaurant_suggestion
can you suggest a french restaurant	restaurant_suggestion
where should i go for dinner	restaurant_suggestion
what mexican restaurant within 5 miles has the best reviews	restaurant_suggestion
do you know of any good seafood restaurants in seattle	restaurant_suggestion
i need suggestions for good thai restaurants in las vegas	restaurant_suggestion
is there any good place for mexican food in hawaii	restaurant_suggestion
please give me the name of a few good options for places to eat dinner tonight	restaurant_suggestion
find me a good spot for southern comfort food in los angeles	restaurant_suggestion
are there good clam places in cleveland	restaurant_suggestion
where can i satisfy my craving for french food in milwaukee	restaurant_suggestion
can you search recommended casual restaurants for tonight in philadelphia	restaurant_suggestion
does boise have any good indian restaurants	restaurant_suggestion
list me some good vietnamese restaurants in new york city	restaurant_suggestion
i'm in the mood for italian, are there any good places around	restaurant_suggestion
any new restaurants near the mall	restaurant_suggestion
tell me which restaurants are good for thai food in las vegas	restaurant_suggestion
i'm craving for italian food, where should i go	restaurant_suggestion
please cancel the table for two at burger king	cancel_reservation
tell the restaurant to cancel my reservation	cancel_reservation
repeal the dinner reservation	cancel_reservation
could you cancel my reservation for winters at the palace tonight	cancel_reservation
is it possible to cancel the reservation at outback for the johnsons	cancel_reservation
please cancel my 7:30 reservation for morton's	cancel_reservation
cancel that reservation for 8 at barney's	cancel_reservation
please cancel the table i had reserved for tonight	cancel_reservation
cancel reservation at eight for the group	cancel_reservation
i need to put in a cancellation for the dinner plans tonight	cancel_reservation
hey siri, please cancel my reservation at the loft for 5	cancel_reservation
cancel my reservation for dinner this saturday	cancel_reservation
i want a cancellation of the dinner reservation for phillips at bernardin's	cancel_reservation
i no longer want my reservation for 5 at the loft cancel it please	cancel_reservation
because of circumstances i don't need my reservation anymore	cancel_reservation
cancel the reservation i made for 8 pm at black rock	cancel_reservation
i have to cancel my reservation after all, please	cancel_reservation
can you cancel the reservation i have at 4 pm at ruth's	cancel_reservation
my reservation for dinner needs to be canceled	cancel_reservation
could i cancel my reservations	cancel_reservation
i gotta cancel my reservation for barry at red robin	cancel_reservation
please cancel the reservation at zephers for joe and myself right now	cancel_reservation
cancel my dinner reservation please	cancel_reservation
please unreserve that table	cancel_reservation
i need to cancel my reservation for rob at red robin	cancel_reservation
i need you to cancel my reservation for 5 at red robin	cancel_reservation
i need to cancel my reservation for 2 at franklin's grille	cancel_reservation
the reservation i placed is not needed anymore	cancel_reservation
remove my dinner reservation	cancel_reservation
i made a reservation for chris at tony's, please cancel it	cancel_reservation
i wish to cancel my reservation for fred at red robin	cancel_reservation
i have to cancel my reservation	cancel_reservation
get rid of my 2 pm reservation at ruth's steakhouse	cancel_reservation
carla doesn't want her olive garden reservation anymore	cancel_reservation
i'll have to cancel my reservation for tonight	cancel_reservation
i need you to cancel my reservation for smith at the williams diner	cancel_reservation
please cancel my reservation at red lobster for 6	cancel_reservation
cancel my reservation at osteria for our party	cancel_reservation
can you cancel my reservation on tuesday for chris at stella maris	cancel_reservation
something's come up so i need to cancel my reservation so now	cancel_reservation
cancel my party reservation for brad at longhorn	cancel_reservation
i need to cancel my reservation after all	cancel_reservation
cancel my reservation for dinner tonight, please	cancel_reservation
i no longer need my reservation with carl at umami	cancel_reservation
can you cancelt the reservation i have for dinner	cancel_reservation
i am not in need of my reservation anymore	cancel_reservation
i won't require my reservation anymore	cancel_reservation
can i cancel my reservations	cancel_reservation
the reservation i created is not necessary anymore	cancel_reservation
i no longer need the dinner reservation	cancel_reservation
i don't need my reservation, can you cancel it	cancel_reservation
end my reservation with carl at umami	cancel_reservation
i'd like to cancel my reservation for 5 at hoss's steak house	cancel_reservation
we have a table at the taco bell under bowie we need to release	cancel_reservation
forget reservation at oyster bar for tonight	cancel_reservation
i need to cancel my reservation after all, please	cancel_reservation
can you cancel my dinner reservation	cancel_reservation
i want you to cancel my reservation for 5 at red robin	cancel_reservation
i no longer need the reservation for 20 at ihop	cancel_reservation
could you please cancel my reservation for 5 at red robin	cancel_reservation
abandon the dinner reservation i made	cancel_reservation
i need to cancel my reservation for new york to xai varanda	cancel_reservation
cancel my reservation for dinner, please	cancel_reservation
please cancel my reservation for chris at brio	cancel_reservation
you can cancel my reservation	cancel_reservation
i need my dinner reservation canceled	cancel_reservation
undo my reservation for 5 at the loft	cancel_reservation
cancel the reservation at olive garden for tommy	cancel_reservation
go ahead and cancel my reservation for 5 at red robin	cancel_reservation
nix that reservation for 4 at strip house	cancel_reservation
go ahead and cancel the reservation i made for 6:00 pm at parc	cancel_reservation
i'd like to cancel the party of 7 we reserved at the olive garden	cancel_reservation
just trash the reservation i made please	cancel_reservation
cancel my reservation for 6 pm at sidetracks	cancel_reservation
im not going to dinner tonight	cancel_reservation
please cancel my reservation	cancel_reservation
get rid of my 4 pm reservation at the steakhouse please	cancel_reservation
hello, i need to cancel tonight's reservation for dinner	cancel_reservation
the reservation at zepher cancel joe from that	cancel_reservation
i do not actually need my reservation anymore	cancel_reservation
get rid of my dinner reservation	cancel_reservation
i need to cancel my dinner reservation	cancel_reservation
i would like to cancel my reservation for nenuco's restaurant to x- tapas	cancel_reservation
i have to cancel my reservation after all	cancel_reservation
tell the restaurant i cannot make it	cancel_reservation
there is no need to confirm my reservation	cancel_reservation
can you undo the reservation	cancel_reservation
cancel tonight's dinner reservation	cancel_reservation
i do not want my reservation anymore	cancel_reservation
i don't need my reservation for 5 at the loft please cancel it	cancel_reservation
i would like you to cancel the dinner reservation for williams at the palace tonight	cancel_reservation
can i cancel my reservations please	cancel_reservation
cancel the reservation for joe and i right now for the zephers reservation we had booked	cancel_reservation
i don't need my reservation, cancel it	cancel_reservation
cancel my reservation for 5 at the loft	cancel_reservation
call off the dinner reservation	cancel_reservation
i want to cancel the reservation for mercury at the ritz	cancel_reservation
would you please cancel the reservations for dinner	cancel_reservation
cancel my reservation for dinner tonight	cancel_reservation
please cancel my reservation for tim at jb's	cancel_reservation
i no longer need a table for four at chili's	cancel_reservation
cancel my reservation for dinner this friday, please	cancel_reservation
cancel my reservation for bob at red robin	cancel_reservation
i have a reservation at pizza hut under the name leia roberts and i want to cancel it	cancel_reservation
can you cancel my reservation for dinner tomorrow	cancel_reservation
cancel my reservation with carl at umami	cancel_reservation
cancel my reservation for dinner	cancel_reservation
can you cancel the reservation for kyle's party at red lobster	cancel_reservation
i don't need the reservation anymore	cancel_reservation
i made a reservation under mark hamil at the emporium that i don't need any more	cancel_reservation
my reservation is no longer needed	cancel_reservation
remove my reservation at outback for timmy	cancel_reservation
get rid of my reservation at chez francois for jennifer	cancel_reservation
please cancel my dinner reservation for tuesday	cancel_reservation
annul the reservation i created	cancel_reservation
i want to cancel my reservation for 5 at red robin	cancel_reservation
cancel my 8:00 pm prime rib reservation	cancel_reservation
make sure my reservation at umami with carl is canceled	cancel_reservation
i no longer want my reservation anymore	cancel_reservation
joe and i are to cancel the reservation at zephers now	cancel_reservation
do i have reservations at creme at 7 pm	confirm_reservation
i would like to try and confirm that i have a reservation at macaroni grill for silva	confirm_reservation
you know the reservation i have on 2:00 friday i confirm it	confirm_reservation
verify my reservation for smith and wollensky at 6:45	confirm_reservation
i would like to try and confirm that i have a reservation at chili’s for melinda	confirm_reservation
can you you confirm my reservation for jean at taco house	confirm_reservation
check to see if i have reservations at prado at 6 pm	confirm_reservation
can you confirm my reservation for steve at olive garden	confirm_reservation
please tell me if my reservation is scheduled for sally's at 3 pm	confirm_reservation
please confirm my reservation for dinner at gusto handcrafted pasta & pizza at 6:30 pm	confirm_reservation
please double check on my reservations for buffalo wild wings at five for the game	confirm_reservation
i need to know if i have reservations at arufflo at 5 pm	confirm_reservation
i would like for you to confirm my reservation for red robin at 5 pm	confirm_reservation
confirm the john reservation at applebee's	confirm_reservation
please double check my reservations for six at mani	confirm_reservation
can you check that there's a reservation for mark at sidetracks	confirm_reservation
can you confirm my reservation for lance at morton's	confirm_reservation
confirm my reservation for joe at hoss's	confirm_reservation
i would like to try and confirm that i have a reservation at longhorn for justin	confirm_reservation
i would like to check my reservation for jean at taco house	confirm_reservation
please verify my reservation for john at bardenay	confirm_reservation
i would like to try and confirm that i have a reservation at macaroni grill for saul	confirm_reservation
i need you to confirm my reservation for tomorrow at 3 pm	confirm_reservation
will you check there is a reservation for laura at black pearl	confirm_reservation
can you confirm my reservation for 8 pm on the 7th of november	confirm_reservation
i want to verify my reservation for the 18th at 1pm	confirm_reservation
please confirm my reservation for kevin at red robin	confirm_reservation
can you please confirm that i have a 6:00 pm table reserved under michelle solomon at devon's	confirm_reservation
are there reservation for joe and will	confirm_reservation
confirm my reservation for acero at 7	confirm_reservation
will you confirm my reservation for red robin at 10	confirm_reservation
is my reservation confirmed for lu shi at 7 pm	confirm_reservation
will you please confirm my reservation for march 11 at 6:30 pm	confirm_reservation
please confirm my reservation for march 1st at 2pm	confirm_reservation
can you confirm my reservation for applebees at 2:00	confirm_reservation
please confirm my reservation for feburary 21st at 6pm	confirm_reservation
can you confirm my reservation for jim at lawry's	confirm_reservation
do i still have the reservation on march 21 at 8pm	confirm_reservation
confirm my reservation for march 12 at 9:00 am	confirm_reservation
has my reservation for john at bardenay been confirmed	confirm_reservation
i want to confirm friday's reservation at 2:00	confirm_reservation
confirm four for my reservation at fiji	confirm_reservation
does taco house have a reservation for jean	confirm_reservation
can you confirm my reservation for dave at outback steakhouse	confirm_reservation
do we know if my reservation for john at bardenay was accepted	confirm_reservation
i must confirm my reservation for 2/20 at 8 pm	confirm_reservation
confirm my friday reservation at 2:00	confirm_reservation
please confirm my reservation for thursday at 10am	confirm_reservation
check to confirm my reservation for february 22 at noon	confirm_reservation
can you check that i have a reservation on february 28th for 3 in the afternoon	confirm_reservation
can you confirm my reservation for minnis at 4:00	confirm_reservation
i would like to try and confirm that i have a reservation at carrabbas for heather	confirm_reservation
can you confirm that i have a reservation for february 21 at 6 o'clock	confirm_reservation
confirm my taco house reservation for jean	confirm_reservation
i would like to try and confirm that i have a reservation at chili's for jamie	confirm_reservation
i need to confirm the reservation for frank at chili's	confirm_reservation
please confirm my reservation for march 8th at 12:00	confirm_reservation
i would like to try and confirm that i have a reservation at houlihan’s for mike	confirm_reservation
will you check to see if i am still reserved for 6:30 pm at gusto handcrafted pasta & pizza	confirm_reservation
check and confirm reservations at ruth chris for carol lee	confirm_reservation
i am here to conform my friday reservation at 2:00	confirm_reservation
please confirm my reservation for april 1st at 9am	confirm_reservation
please confirm that i have a reservation for 2/20 at 6:00 pm	confirm_reservation
confirm my reservation at dino's at 6 pm	confirm_reservation
can you confirm my reservation for chillis at 8:00	confirm_reservation
i wanna try and confirm that i have a reservation at red robin for josh	confirm_reservation
can you confirm the reservation at fleming's for jane	confirm_reservation
tell me if i have reservations at the back abbey at 6 pm	confirm_reservation
i'd like to confirm the 2:00 reservation for friday	confirm_reservation
can you check for reservations at wongs chinese for john acer	confirm_reservation
i have a reservation for strip house for jennifer that i'd like to confirm	confirm_reservation
check to see if i am still booked to be eating at gusto handcrafted pasta & pizza at 6:30 pm	confirm_reservation
can you verify my reservation under steve for friendly's	confirm_reservation
confirm a reservation for nicole brown at diangelo's at 6:45 pm, please	confirm_reservation
is my dinner reservation for gusto handcrafted pasta & pizza at 6:30 pm still valid	confirm_reservation
tell me whether or not i have a reservation at gramercy tavern for tad	confirm_reservation
i need you to confirm my reservation for kevin at red robin	confirm_reservation
find my reservation for steve at crucere's and confirm it, please	confirm_reservation
i would like to try and confirm that i have a reservation at gusteau's for krystine	confirm_reservation
please confirm i have a reservation for 2 pm on february 21st	confirm_reservation
i would like to try and confirm that i have a reservation at la palapa for bolding	confirm_reservation
i'd like to confirm that i have a reservation at red robin for josh	confirm_reservation
is there a reservation for mark at mimis	confirm_reservation
do you know if my reservation for dono is confirmed at 8 pm	confirm_reservation
verify that my reservations at won wons for joe lee are good	confirm_reservation
i would like to try and confirm that i have a reservation at applebee's for kristen	confirm_reservation
can you confirm my reservation for torris at 7:00	confirm_reservation
i'd like to confirm my reservation for 2/20 at 8 pm	confirm_reservation
can you verify mike has a reservation at black rock at 6 pm	confirm_reservation
"""let's try and confirm my reservation for bubble bar under """"franklin"""	confirm_reservation
confirm my johnny rockets reservation for this evening	confirm_reservation
confirm my reservation for red robin at 8	confirm_reservation
can you confirm my reservation for donnobys at 5:00	confirm_reservation
make sure my reservation is happening for john at olive garden	confirm_reservation
i would like to confirm my 7:30 pm reservation at morton's steakhouse, under michael james	confirm_reservation
i would like to try and confirm that i have a reservation at the seven dwarves for peter	confirm_reservation
please confirm my reservation for red robin at 9	confirm_reservation
i wanna confirm my reservation for 2/20 at 8 pm	confirm_reservation
double check my reservation under adam for outback steakhouse	confirm_reservation
i really want to confirm that i have a reservation at red robin for josh	confirm_reservation
